{"activation":{"bounded_batch":null,"ordering":"input_then_output_ordinal","shape":"per_item_stream"},"capabilities":[],"compatibility":{"aliases":[],"profile":"native","safe_opaque_fields":{}},"configuration":{"defaults":{"count":1,"data":null,"start":0,"step":1,"storage_mode":"auto"},"editor_hints":{"count":{"control":"number","label":"Item count"},"data":{"control":"json","label":"Fixed data"},"start":{"control":"number","label":"Start value"},"step":{"control":"number","label":"Step"},"storage_mode":{"control":"select","label":"Storage mode"}},"schema":{"additionalProperties":false,"properties":{"count":{"maximum":50000,"minimum":0,"type":"integer"},"data":{},"start":{"maximum":9223372036854775807,"minimum":-9223372036854775808,"type":"integer"},"step":{"maximum":9223372036854775807,"minimum":-9223372036854775808,"type":"integer"},"storage_mode":{"enum":["auto","artifact"],"type":"string"}},"required":["count","start","step","data","storage_mode"],"type":"object"}},"effects":{"approval_required":false,"class":"pure","deterministic":true,"idempotent":true,"reconciliation":"not_required","retry":"safe"},"extensions":{"canopy.workbench/display":{"accent":"violet","description":"Expand one input into a deterministic ordered range.","display_name":"Generate Items"}},"identity":{"api_version":"v1alpha1","license":"Apache-2.0","name":"generate-items","namespace":"canopy.native","publisher":"Canopy Workbench","version":"0.1.0"},"outcomes":{"allowed":["success","permanent_failure","durable_suspension","cancelled"],"error_namespace":"canopy.generate-items"},"ports":{"inputs":[{"cardinality":"one","id":"input","multiplicity":"one","required":true,"schema":{"type":"dynamic-item"}}],"outputs":[{"cardinality":"many","id":"items","multiplicity":"many","required":true,"schema":{"type":"dynamic-item"}}]},"resources":{"default":{"artifact_bytes":33554432,"concurrency":1,"cpu_millis":5000,"input_bytes":8388608,"input_count":1,"memory_bytes":4194304,"output_bytes":67108864,"output_count":50000,"wall_millis":300000},"hard":{"artifact_bytes":33554432,"concurrency":1,"cpu_millis":300000,"input_bytes":8388608,"input_count":1,"memory_bytes":16777216,"output_bytes":67108864,"output_count":50000,"wall_millis":900000}}}
