{"activation":{"bounded_batch":null,"ordering":"captured_invocation","shape":"source"},"capabilities":[],"compatibility":{"aliases":[],"profile":"native","safe_opaque_fields":{}},"configuration":{"defaults":{"capture_mode":"manual"},"editor_hints":{"capture_mode":{"control":"select","label":"Invocation capture"}},"schema":{"additionalProperties":false,"properties":{"capture_mode":{"enum":["manual"],"type":"string"}},"required":["capture_mode"],"type":"object"}},"effects":{"approval_required":false,"class":"pure","deterministic":true,"idempotent":true,"reconciliation":"not_required","retry":"safe"},"extensions":{"canopy.workbench/display":{"accent":"mint","description":"Begin a Workflow with one owner-captured invocation.","display_name":"Manual Trigger"}},"identity":{"api_version":"v1alpha1","license":"Apache-2.0","name":"manual-trigger","namespace":"canopy.native","publisher":"Canopy Workbench","version":"0.1.0"},"outcomes":{"allowed":["success","permanent_failure","cancelled"],"error_namespace":"canopy.manual-trigger"},"ports":{"inputs":[],"outputs":[{"cardinality":"one","id":"invocation","multiplicity":"one","required":true,"schema":{"type":"dynamic-item"}}]},"resources":{"default":{"artifact_bytes":0,"concurrency":1,"cpu_millis":10,"input_bytes":0,"input_count":0,"memory_bytes":1048576,"output_bytes":1048576,"output_count":1,"wall_millis":1000},"hard":{"artifact_bytes":0,"concurrency":1,"cpu_millis":100,"input_bytes":0,"input_count":0,"memory_bytes":8388608,"output_bytes":8388608,"output_count":1,"wall_millis":10000}}}
